{
  "design_only": true,
  "case_id": "shared-resource-second-consumer-missing",
  "bundle": {
    "format_version": "a03-exchange-1",
    "evidence": [
      {
        "evidence_id": "proof-source",
        "resource": {
          "path": "assets/proof-source.txt",
          "sha256": "1f36e585be64bf251bd9377e4a6dd62602a1d30855ad356821b98d7727985700",
          "media_type": "text/plain",
          "origin": "SYNTHETIC"
        },
        "description": "Synthetic original assets and external page mapping.",
        "mode": "SYNTHETIC"
      },
      {
        "evidence_id": "proof-geometry",
        "resource": {
          "path": "assets/proof-geometry.txt",
          "sha256": "e81a4a5245db90f68da55b69cffadb234df70a4a2dbf5b8c660a24c638fe74d6",
          "media_type": "text/plain",
          "origin": "SYNTHETIC"
        },
        "description": "Hand-authored original boxes, coverage and invertible transform; not detector output.",
        "mode": "SYNTHETIC"
      },
      {
        "evidence_id": "proof-checks",
        "resource": {
          "path": "assets/proof-checks.txt",
          "sha256": "a674f58c3a7ebc30cd00d9f52106655169f2228436ecc027b1cae73ebaba1d46",
          "media_type": "text/plain",
          "origin": "SYNTHETIC"
        },
        "description": "Constructed quality assertions, never platform acceptance.",
        "mode": "SYNTHETIC"
      },
      {
        "evidence_id": "proof-target",
        "resource": {
          "path": "assets/proof-target.txt",
          "sha256": "c77d1a442645b7677759706f1ca1c993deb96f967b9e00ffe51bc0d1c407c38f",
          "media_type": "text/plain",
          "origin": "SYNTHETIC"
        },
        "description": "Invented same-session target state and capabilities.",
        "mode": "SYNTHETIC"
      },
      {
        "evidence_id": "proof-before",
        "resource": {
          "path": "assets/proof-before.txt",
          "sha256": "c14b6e590e4253ff847a0b486c289a93be9bf3aa3a991070a3a810253c58ad61",
          "media_type": "text/plain",
          "origin": "SYNTHETIC"
        },
        "description": "Invented per-action state before simulated write.",
        "mode": "SYNTHETIC"
      },
      {
        "evidence_id": "proof-after",
        "resource": {
          "path": "assets/proof-after.txt",
          "sha256": "0ed35e1f765f34e8b59ca41acbb3b84a80d4cb720db99dbbb6727ae442f2773e",
          "media_type": "text/plain",
          "origin": "SYNTHETIC"
        },
        "description": "Invented readback including final synthetic content.",
        "mode": "SYNTHETIC"
      },
      {
        "evidence_id": "proof-timeout",
        "resource": {
          "path": "assets/proof-timeout.txt",
          "sha256": "d1029a7ebe16a7e3f46b537013510f6852bd23054f4fd6c443fb55a88c75948b",
          "media_type": "text/plain",
          "origin": "SYNTHETIC"
        },
        "description": "Simulated response timeout with no conclusive readback; no duplicate dispatch permitted.",
        "mode": "SYNTHETIC"
      },
      {
        "evidence_id": "proof-patch",
        "resource": {
          "path": "assets/proof-patch.txt",
          "sha256": "1196f4c02fafc7482147b5dc932f019f6eee8f5d55c835012d714cff18aedf58",
          "media_type": "text/plain",
          "origin": "SYNTHETIC"
        },
        "description": "Synthetic review changed printed label; baseline and result revisions remain separate.",
        "mode": "SYNTHETIC"
      },
      {
        "evidence_id": "proof-a02-1-0-before",
        "resource": {
          "path": "assets/r1/e7563be3dd65e209d9664c165fe12e5345189bb152d02b4d84d49bc156555e25.json",
          "sha256": "e7563be3dd65e209d9664c165fe12e5345189bb152d02b4d84d49bc156555e25",
          "media_type": "application/json",
          "origin": "SYNTHETIC"
        },
        "description": "SYNTHETIC / SIMULATED independently captured 0-before",
        "mode": "SYNTHETIC"
      },
      {
        "evidence_id": "proof-a02-1-0-readback",
        "resource": {
          "path": "assets/r1/b872dcb7705bbfe6327a79d365779dfac746875b374099ae3645749f3945c787.json",
          "sha256": "b872dcb7705bbfe6327a79d365779dfac746875b374099ae3645749f3945c787",
          "media_type": "application/json",
          "origin": "SYNTHETIC"
        },
        "description": "SYNTHETIC / SIMULATED independently captured 0-readback",
        "mode": "SYNTHETIC"
      },
      {
        "evidence_id": "proof-a02-1-1-before",
        "resource": {
          "path": "assets/r1/86d2315930652244106d204d9986fd7d0ef6acb1e1ed15ab8e20bdd793b6312f.json",
          "sha256": "86d2315930652244106d204d9986fd7d0ef6acb1e1ed15ab8e20bdd793b6312f",
          "media_type": "application/json",
          "origin": "SYNTHETIC"
        },
        "description": "SYNTHETIC / SIMULATED independently captured 1-before",
        "mode": "SYNTHETIC"
      },
      {
        "evidence_id": "proof-a02-1-1-readback",
        "resource": {
          "path": "assets/r1/ef9e832654e0e4349640ca325c288756355a08036e199fcc5616367e89d68e80.json",
          "sha256": "ef9e832654e0e4349640ca325c288756355a08036e199fcc5616367e89d68e80",
          "media_type": "application/json",
          "origin": "SYNTHETIC"
        },
        "description": "SYNTHETIC / SIMULATED independently captured 1-readback",
        "mode": "SYNTHETIC"
      },
      {
        "evidence_id": "proof-a02-1-2-before",
        "resource": {
          "path": "assets/r1/2c44f0dda5c480cd7c6e38e0a3973b44fa6af43938354cc60138d0c478448129.json",
          "sha256": "2c44f0dda5c480cd7c6e38e0a3973b44fa6af43938354cc60138d0c478448129",
          "media_type": "application/json",
          "origin": "SYNTHETIC"
        },
        "description": "SYNTHETIC / SIMULATED independently captured 2-before",
        "mode": "SYNTHETIC"
      },
      {
        "evidence_id": "proof-a02-1-2-readback",
        "resource": {
          "path": "assets/r1/795e3119ea05a3851cabb525ce300e0eff86c6d74aab85eb6528f3af7ab4055e.json",
          "sha256": "795e3119ea05a3851cabb525ce300e0eff86c6d74aab85eb6528f3af7ab4055e",
          "media_type": "application/json",
          "origin": "SYNTHETIC"
        },
        "description": "SYNTHETIC / SIMULATED independently captured 2-readback",
        "mode": "SYNTHETIC"
      }
    ],
    "policies": [
      {
        "policy_id": "synthetic-a02-policy",
        "revision": 1,
        "content_hash": "5d914617cad7f10009ff34919b1c313d5c73bd322069b77cde54659a407ebc32",
        "confirmation_status": "SYNTHETIC_ASSUMPTION",
        "option_grouping": "SEPARATE",
        "role_mapping": {
          "stem": "Q",
          "option": "W",
          "answer": "A",
          "explanation": "E",
          "shared_material": "Q"
        },
        "source_notes": [
          "SYNTHETIC A02 simulation assumption; no A/B or platform confirmation.",
          "SEPARATE options are supported only by this offline simulator."
        ],
        "frame_save_status": "SYNTHETIC",
        "ocr_status": "SYNTHETIC",
        "applicability": "SYNTHETIC_ONLY"
      }
    ],
    "artifacts": [
      {
        "schema_version": "1.1.0-a-recovery-proposal",
        "artifact_id": "a02-source",
        "revision": 1,
        "kind": "SourceBundle",
        "run_id": "a03-design-run",
        "book_id": "synthetic-book",
        "scope_id": "synthetic-scope",
        "input_refs": [],
        "producer": {
          "module": "a02-synthetic-input",
          "implementation_version": "a03-P1-NOT-IMPLEMENTED",
          "config_version": "DESIGN_ONLY",
          "policy_versions": [
            {
              "policy_id": "synthetic-a02-policy",
              "revision": 1,
              "content_hash": "5d914617cad7f10009ff34919b1c313d5c73bd322069b77cde54659a407ebc32"
            }
          ],
          "model_version": null,
          "prompt_version": null,
          "evidence_mode": "SYNTHETIC"
        },
        "content_hash": "7b761b95ea822931077cac9353be0e61be60654e7b71a4b35eae8a3fe61af5a4",
        "created_at": "2026-10-17T00:00:00Z",
        "payload": {
          "assets": [
            {
              "path": "assets/asset-page-a1.pgm",
              "sha256": "8c1f2dc9061d60bad2a28778bf18f0356409b9fa8c370a0db6bd737012db2a75",
              "media_type": "image/x-portable-graymap",
              "asset_id": "asset-page-a1",
              "width": 80,
              "height": 100,
              "source_label": "Synthetic original page 1",
              "provenance": "SYNTHETIC",
              "origin": "SYNTHETIC"
            },
            {
              "path": "assets/asset-page-a2.pgm",
              "sha256": "9f4ab681d43e03b397154a2ba6dabf9b77e1bbfe576c62955d4385755f6d5d1b",
              "media_type": "image/x-portable-graymap",
              "asset_id": "asset-page-a2",
              "width": 80,
              "height": 100,
              "source_label": "Synthetic original page 2",
              "provenance": "SYNTHETIC",
              "origin": "SYNTHETIC"
            },
            {
              "path": "assets/asset-page-b1.pgm",
              "sha256": "f4d0189a5c4953e4401ef67acdc922d73a4414b7e86328e44b0ca98955243b84",
              "media_type": "image/x-portable-graymap",
              "asset_id": "asset-page-b1",
              "width": 80,
              "height": 100,
              "source_label": "Synthetic original page 3",
              "provenance": "SYNTHETIC",
              "origin": "SYNTHETIC"
            }
          ],
          "directories": [
            {
              "directory_id": "directory-a",
              "parent_id": null,
              "label": "Unit A"
            },
            {
              "directory_id": "directory-b",
              "parent_id": null,
              "label": "Unit B"
            }
          ],
          "pages_expected": [
            "asset-page-a1",
            "asset-page-a2",
            "asset-page-b1"
          ],
          "pages_acquired": [